{
  "schema": "neuronexus.source-ledger.v3",
  "project": "NeuroNexus",
  "generated_by": "tools/migrations/ledger_v2_to_v3.py (once), then edited directly",
  "evidence_classes": {
    "OBSERVED": "A real instrument measurement from a mission archive.",
    "NASA REFERENCE": "A published NASA/USGS/partner reference value, catalog or map.",
    "MODELED": "Output of a physical model (e.g. NASA Ames Mars GCM).",
    "DERIVED": "Computed by NeuroNexus from observed or modeled inputs.",
    "COMPUTED": "Geometry or arithmetic computed by NeuroNexus.",
    "SIMULATED": "A configurable NeuroNexus simulation value, not a measurement.",
    "AI INTERPRETATION": "Language-model interpretation of structured results; never a NASA observation."
  },
  "ingestion_statuses": {
    "INGESTED": "Data are read and used by the pipeline.",
    "QUERIED LIVE": "Fetched from the provider at run time (cached).",
    "REFERENCE ONLY": "Linked for context; the data are not ingested.",
    "CATALOGED NOT INGESTED": "Registered but not ingested; nothing is inferred from it.",
    "UNAVAILABLE": "Known but not reachable or not usable."
  },
  "legacy_export": {
    "project": "NeuroNexus",
    "schema_version": "3.0",
    "purpose": "External-source and provenance ledger for the NeuroNexus Mars mission-planning and scientific intelligence system.",
    "provenance_boundary": {
      "external_sources": "Authoritative or external datasets, APIs, catalogues, models, imagery, and reference material used by NeuroNexus.",
      "derived_outputs": "Values and classifications calculated by NeuroNexus from external inputs.",
      "team_methods": "Algorithms, scoring methods, route objectives, and models implemented by the NeuroNexus team.",
      "ai_interpretation": "Google Gemini interpretation of structured NeuroNexus results; AI prose is never treated as a NASA observation.",
      "unavailable": "A source or dataset that is known/referenced but not ingested into the application is explicitly marked unavailable or not_ingested rather than replaced with invented data."
    },
    "evidence_statuses": {
      "USED": "External source actively used by an application subsystem.",
      "USED_AND_INGESTED": "External source data are locally ingested/indexed and used by the scientific pipeline.",
      "USED_AS_REFERENCE": "External source supports scientific or mission context but is not necessarily a locally ingested measurement dataset.",
      "USED_AS_REFERENCE_ONLY": "External source is linked/referenced for context; the underlying full dataset is not ingested.",
      "CATALOGUED_NOT_INGESTED": "The source is registered in the science catalogue/provenance roadmap but its data are not currently ingested for site-specific calculations.",
      "UNAVAILABLE": "The source is known but unavailable in the current runtime; NeuroNexus does not fabricate a substitute."
    },
    "project_boundary": {
      "no_fake_data": true,
      "no_nasa_certified_safety_claims": true,
      "no_present_day_habitability_claim_from_ancient_evidence": true,
      "no_resource_confirmation_from_context_layers": true,
      "ai_is_not_presented_as_nasa_observation": true,
      "unavailable_data_are_reported_explicitly": true
    }
  },
  "legacy_provenance": {
    "evidence_statuses": {
      "PROJECT DATA": "Stored in this application's own state.",
      "NASA OBSERVED": "A real instrument measurement from a NASA mission archive.",
      "NASA REFERENCE": "A published NASA/USGS reference value or catalogue entry.",
      "MODELED": "Output of a physical model (e.g. NASA Ames Mars GCM).",
      "DERIVED": "Computed by NeuroNexus from observed or modelled inputs.",
      "COMPUTED": "Pure geometry or arithmetic computed by NeuroNexus.",
      "SIMULATED": "A configurable NeuroNexus simulation value, not a measurement.",
      "UNAVAILABLE": "No evidence is ingested; nothing is inferred."
    }
  },
  "entries": [
    {
      "id": "NASA_PDS",
      "aliases": [],
      "organization": "NASA Planetary Data System",
      "mission": null,
      "instrument": null,
      "product_title": "Nasa Pds",
      "product_id_pattern": null,
      "doi": null,
      "url": "https://pds.nasa.gov/",
      "landing_page": null,
      "license": null,
      "citation": null,
      "evidence_class": "NASA REFERENCE",
      "ingestion_status": "QUERIED LIVE",
      "access_method": null,
      "used_by": [],
      "retrieved_at": null,
      "version": null,
      "archive_lag_days": null,
      "caveats": [],
      "verified_on": null,
      "verification_note": "Carried over from the v2 ledgers; not re-verified.",
      "legacy": {
        "id": "NASA_PDS",
        "role": "primary_archive",
        "status": "USED",
        "used_for": [
          "authoritative planetary-data archive",
          "MOLA data provenance",
          "Mars science dataset provenance"
        ]
      }
    },
    {
      "id": "MOLA_MEGDR",
      "aliases": [
        "MOLA",
        "nasa_mola"
      ],
      "organization": "NASA / Mars Global Surveyor / MOLA",
      "mission": "Mars Global Surveyor",
      "instrument": "MOLA",
      "product_title": "MOLA MEGDR 128 pixels/degree topography (MGS-M-MOLA-5-MEGDR-L3-V1.0)",
      "product_id_pattern": "megt*hb.img / megr*hb.img",
      "doi": null,
      "url": "https://pds-geosciences.wustl.edu/mgs/mgs-m-mola-5-megdr-l3-v1/mgsl_300x/meg128/",
      "landing_page": "https://pds-geosciences.wustl.edu/missions/mgs/megdr.html",
      "license": "public domain (NASA PDS)",
      "citation": "Smith et al. (2003), MGS-M-MOLA-5-MEGDR-L3-V1.0, NASA PDS",
      "evidence_class": "OBSERVED",
      "ingestion_status": "INGESTED",
      "access_method": "tools/fetch_mola.py (size-checked, sha256 logged); memory-mapped",
      "used_by": [],
      "retrieved_at": null,
      "version": null,
      "archive_lag_days": null,
      "caveats": [],
      "verified_on": "2026-10-20",
      "verification_note": "megt00n090hb/megr00n090hb/megt44n000hb/megr44n000hb downloaded from PDS: 129,761,280 bytes each; megr label OFFSET = 3396000, SCALING_FACTOR = 1, UNIT = METER.",
      "legacy": {
        "id": "MOLA",
        "role": "terrain",
        "status": "USED_AND_INGESTED",
        "used_for": [
          "global elevation",
          "bounded local terrain windows",
          "slope derivation",
          "roughness derivation",
          "local relief",
          "deterministic route-planning terrain grids",
          "waypoint terrain analysis"
        ],
        "extra": {
          "datasets": [
            "MGS-M-MOLA-5-MEGDR-L3-V1.0 128 px/degree global topography",
            "MOLA polar 512 px/degree topography"
          ]
        }
      },
      "provenance": {
        "class": "EXTERNAL SOURCE",
        "use": "Elevation, slope, roughness, route planning grid and terrain metrics."
      }
    },
    {
      "id": "THEMIS",
      "aliases": [
        "nasa_themis"
      ],
      "organization": "NASA / Mars Odyssey / THEMIS / Arizona State University",
      "mission": "2001 Mars Odyssey",
      "instrument": "THEMIS",
      "product_title": "THEMIS IR predicted brightness temperature observations",
      "product_id_pattern": null,
      "doi": null,
      "url": "https://themis.asu.edu/",
      "landing_page": null,
      "license": null,
      "citation": null,
      "evidence_class": "OBSERVED",
      "ingestion_status": "INGESTED",
      "access_method": null,
      "used_by": [],
      "retrieved_at": null,
      "version": null,
      "archive_lag_days": null,
      "caveats": [
        "THEMIS values in NeuroNexus represent historical archived observations, not live measurements."
      ],
      "verified_on": null,
      "verification_note": "Carried over from the v2 ledgers; not re-verified.",
      "legacy": {
        "id": "THEMIS",
        "role": "visible_and_thermal_imagery",
        "status": "USED_AND_INGESTED",
        "used_for": [
          "historical thermal observations",
          "IR predicted brightness-temperature context",
          "site thermal evidence",
          "THEMIS-derived scientific indexing"
        ],
        "note": "THEMIS values in NeuroNexus represent historical archived observations, not live measurements."
      },
      "provenance": {
        "class": "EXTERNAL SOURCE",
        "use": "Historical thermal evidence at and around sites."
      }
    },
    {
      "id": "NASA_AMES_MGCM",
      "aliases": [
        "nasa_ames_mgcm"
      ],
      "organization": "NASA Ames Research Center",
      "mission": null,
      "instrument": null,
      "product_title": "Mars Global Climate Model MY34 dust scenario",
      "product_id_pattern": null,
      "doi": null,
      "url": "https://www.nasa.gov/space-science-and-astrobiology-at-ames/division-overview/planetary-systems-branch-overview-stt/mars-climate-modeling-center-mcmc/",
      "landing_page": null,
      "license": null,
      "citation": null,
      "evidence_class": "MODELED",
      "ingestion_status": "INGESTED",
      "access_method": null,
      "used_by": [],
      "retrieved_at": null,
      "version": null,
      "archive_lag_days": null,
      "caveats": [],
      "verified_on": null,
      "verification_note": "Carried over from the v2 ledgers; not re-verified.",
      "legacy": {
        "id": "NASA_AMES_MGCM",
        "role": "mars_climate_model",
        "status": "USED_AND_INGESTED",
        "used_for": [
          "MY34 modelled dust opacity context",
          "dust height/scenario information"
        ],
        "extra": {
          "evidence_class": "MODELED"
        }
      },
      "provenance": {
        "class": "EXTERNAL SOURCE",
        "use": "Modelled dust opacity and height."
      }
    },
    {
      "id": "USGS_IAU_GAZETTEER",
      "aliases": [
        "usgs_nomenclature"
      ],
      "organization": "USGS Astrogeology / International Astronomical Union",
      "mission": null,
      "instrument": null,